Created,Domain,Title
1483421402.0,Foxnews,Turkish authorities close to identifying Istanbul gunman
1483419674.0,Foxnews,At least 36 killed after suicide bomber targets crowded Baghdad market
1483386494.0,Foxnews,At least 22 killed after suicide bomber targets crowded Baghdad market
1483381376.0,Foxnews,Spicer hints Obama's Russian sanctions 'politically motivated'
1483372173.0,Foxnews,Russian diplomats expelled in connection with cyber hacks depart US
1483376818.0,Foxnews,US general hands Iraqis fighting in Mosul vote of confidence
1483237121.0,Foxnews,16 bodies recovered after mine collapse in India
1495583632.0,Independent,Nearly 94% of Shell shareholders reject emissions reduction target in line with Paris climate agreement - Fossil fuel giant's board argues setting targets to reduce its production of greenhouse gases is 'not in the best interest of the company'
1495591805.0,Independent,Philippines soldiers battle Isis-linked gunmen on Marawi city streets
1495593489.0,Independent,India cancels plans for huge coal power stations as solar energy prices hit record low
1495586443.0,Independent,"Spanish man climbs Mount Everest in fastest known time, completely on his own"
1495571215.0,Independent,Manchester Arena attack: Isis claims responsibility for suicide bombing that killed at least 22 people
1495569682.0,Independent,UK General election 2017: Quarter of a million under-25s register to vote in one day - Young people heavily outnumbered people of pensionable age among registrees
1495564114.0,Independent,Theresa May accused of lying about 'dementia tax' care amid backlash over U-turn
1495559379.0,Independent,South Korea fires warning shots at North Korea after an 'unidentified object' flies over DMZ
1495557018.0,Independent,"ISIS tests chemical weapons on 'human guinea pigs', secret documents reveal"
1495552303.0,Independent,London Victoria coach station evacuated as 'ongoing incident' declared by police
1495539636.0,Independent,EU's chief negotiator says 'we are ready' for Brexit talks
1495498638.0,Independent,UK Labour support surges in Wales with 16-point shift towards Jeremy Corbyn's party - The party has overtaken the Tories in Wales and has a 10 point lead
1495504050.0,Independent,Donald Trump becomes first sitting US president to visit Western Wall
1495498326.0,Independent,Nasa to launch emergency spacewalk after International Space Station computer breaks
1495503992.0,Independent,Marine Le Pen to abandon ‘Frexit’ plans following disastrous election defeat
1495485684.0,Independent,'Dementia tax': UK Tories buy Google ads to stop people reading about controversy over new policy - News stories about the social care policy are almost universally critical
1495477347.0,Independent,"South African hunter Theunis Botha crushed to death by elephant after it is fatally shot in Zimbabwe | Botha, 51, from Johannesberg, was leading a hunt in Gwai, Zimbabwe, when they stumbled across a herd of elephants, which included pregnant cows."
1495485897.0,Independent,Recep Tayyip Erdogan tightens grip by extending state of emergency until Turkey achieves ‘welfare and peace’
1495479697.0,Independent,Theresa May waters down 'dementia tax' in extraordinary U-turn after poll lead slashed
1495487677.0,Independent,Turkey places 200 senior military commanders on trial for plotting coup
1495487476.0,Independent,"Israel lays on 10,000 extra police during Trump visit as Palestinian factions threaten 'day of rage'"
1495480699.0,Independent,Brexit 'opportunity' for eurozone financial sector says French minister - The European Central Bank has previously sought to require euro-denominated clearing to be shifted from the City of London and into the single currency area
1495494813.0,Independent,Nato denies its Secretary-General said Trump has a '12-second attention span'
1495490888.0,Independent,Nato to welcome Montenegro to the defence alliance in first expansion of membership in eight years
1495487704.0,Independent,Switzerland votes to phase out nuclear energy and switch to renewables
1495470650.0,Independent,Donald Trump drops out of Saudi Arabia event due to 'exhaustion'
1495460867.0,Independent,Mark Zuckerberg just signed the death warrant for the smartphone
1495447807.0,Independent,Victims of slavery and human trafficking 'abandoned' as soon as they are identified
1495436901.0,Independent,"Brexit: Lost access to single market in services could cost UK economy up to £36bn, new report concludes - Leaving the single market in services could lead to a loss of between 1.4 and 2 per cent of gross domestic product"
1495449072.0,Independent,Thousands of refugees on Greek islands risk losing vital services as charities prepare to withdraw
1495419744.0,Independent,"Donald Trump should be more concerned about preventing another 9/11 than making claims about Iran, country’s foreign minister warns"
1495417030.0,Independent,Donald Trump says Iran has helped commit 'unspeakable crimes' in Syria with Bashar al-Assad
1495417512.0,Independent,"Iran is the 'spearhead of global terrorism', Saudi king claims"
1495421358.0,Independent,Saudi foreign minister: US-Saudi alliance will 'drain the swamp' of extremism
1495389417.0,Independent,"Almost one million families to be hit by Theresa May's plan to end free school lunches, think tank warns - The Prime Minister has been branded ""the lunch snatcher"" over plans which the Education Policy Institute claims could cost hard-working families up to £440 a year"
1495389351.0,Independent,"Brexit Secretary David Davis warns Britain will walk out of talks if EU demands €100bn - 'We don’t need to just look like we can walk away, we need to be able to walk away'"
1495376444.0,Independent,Julian Assange's mother calls on Australian Prime Minister to help secure his release - Christine Assange asks Malcolm Turnbull to re-issue son’s passport so he can move to Ecuador
1495353198.0,Independent,20 million people are starving and the media only cares about Trump says UN
1495355835.0,Independent,"Donald Trump has been accused of hypocrisy after appearing to ""curtsey"" while receiving a gold medal from the king of Saudi Arabia. Back in 2012, Mr Trump criticised his predecessor Barack Obama for bowing to foreign leaders, including then-Saudi King Abdullah."
1495355986.0,Independent,Authorities in Mexico City have ordered cars off the streets and warned people about exercising outdoors as sprawling metropolis chokes in its worst smog for nearly two decades. Hundreds of thousands of less efficient vehicles have been banned from the roads in the Mexican capital
1495356172.0,Independent,"UK Conservatives' rebrand as 'party of the workers' failing as they struggle to shake off 'nasty' tag, poll shows - Exclusive poll shows 47 per cent of the public think Labour would best represent the working class"
1495356796.0,Independent,Tory ministers accept 20 luxury food hampers from Saudi Arabian regime worsening famine in Yemen - Campaigners said the gifts were a symbol of the government’s close relationship with the autocracy
1495356092.0,Independent,"Iraq's special forces have declared their mission in Mosul complete after some of the last remaining western districts were retaken from Isis. Despite the announcement, battles are still raging in a handful of neighbourhoods, forcing hundreds of civilians to flee each day."
1495340228.0,Independent,Saudi king tells Donald Trump Syrians 'brought destruction to their own country'
1495315237.0,Independent,Italy makes 12 vaccines mandatory for school children in an attempt to combat ‘anti-scientific theories’
1495316870.0,Independent,Stephen Hawking says we must colonise other planets to ensure human survival - 'We are running out of space on Earth and we need to break through the technical limitations preventing us living elsewhere in the universe'
1495302983.0,Independent,MI5 'kept file on Jeremy Corbyn over his IRA sympathies'
1495268221.0,Independent,"Cash-strapped UK councils breaking the law on air pollution, documents reveal - Exclusive poll for The Independent shows public – and most Conservative voters – back banning the most-polluting cars from city centres as pressure builds on the Government"
1495257822.0,Independent,Donald Trump's son-in-law Jared Kushner 'person of interest in Russia investigation'
1495236533.0,Independent,Saudi Arabia to serve Donald Trump steak and ketchup to keep him happy
1495241895.0,Independent,"Jeremy Corbyn far more likely to be attacked by media than Theresa May, election reporting audit reveals - Newspaper and TV coverage has been overwhelmingly hostile, according to the study"
1495242040.0,Independent,UK Tory councillor says pregnant Labour candidate can’t be MP as she’ll be ‘too busy’ changing nappies - 'How can a woman who is just about to give birth take on a role as MP?' asks Conservative councillor
1495226124.0,Independent,Theresa May to create new internet that would be controlled and regulated by government
1495224243.0,Independent,Theresa May to create new internet that would be controlled and regulated by government
1495230691.0,Independent,Nigel Farage halts interview after questions about Julian Assange and Russia links
1495216373.0,Independent,"Julian Assange will still be arrested if he leaves Ecuadorian embassy in London, Met Police confirms"
1495236000.0,Independent,Top UK university removes Muslim prayer spaces during exam season on eve of Ramadan
1495226822.0,Independent,Japan and China successfully extract ‘combustible ice’ from seafloor in potential energy breakthrough
1495214912.0,Independent,Julian Assange: Sweden drops investigation against Wikileaks founder based in Ecuador's London embassy
1495228293.0,Independent,"Scottish Tories demand exemption from Theresa May’s Winter Fuel Allowance cuts because it’s colder - Scotland has 'different climatic issues', the Conservative Scottish Secretary said"
1495214795.0,Independent,Julian Assange: Sweden drops investigation against Wikileaks founder based in Ecuador's London embassy
1495205995.0,Independent,"UK Conservatives will force people to use photo ID to vote, stopping millions from taking part in future elections - The law could ban a whole 7.5 per cent of the electorate from voting"
1495213378.0,Independent,Donald Trump cancels visit to ancient Israel fortress because ‘he cannot land his helicopter’ on site
1495196310.0,Independent,"Scientists decide to bury 5,000-year-old lost city in Pakistan - Mohenjo Daro is threatened by the baking temperatures of the Indus Valley and the threat from tourists and terrorists"
1495192750.0,Independent,"Theresa May accused of failing to tackle the growing crisis in NHS and social care, with a 'smoke and mirrors' manifesto"
1495177326.0,Independent,Antarctic turning green as global warming triggers moss explosion
1495187613.0,Independent,Remote control: air-traffic staff to work 80 miles away from the airport - London City says the move to a remote will make flying safer and more efficient
1495152344.0,Independent,Austrian parliament passes burqa ban seeing Muslim women face £130 fines for wearing full-face veils
1495154453.0,Independent,Tories just quietly hiked up minimum income threshold to bring in foreign spouses
1495159170.0,Independent,German police may have 'covered up' repeated failure to arrest Berlin attacker before Isis massacre
1495153655.0,Independent,Jeremy Corbyn gains eight points on Conservatives in new poll usually unfavourable to Labour
1495155125.0,Independent,"Isis kills 50 soldiers and civilians in central Syria attack, says watchdog"
1495154098.0,Independent,"Isis kills 50 soldiers and civilians in central Syria attack, says watchdog"
1495131531.0,Independent,EU warns Donald Trump: Paris agreement on climate change is ‘irreversible and non-negotiable’
1495138095.0,Independent,"Pirates of the Caribbean 5: Hackers hold Disney ransom, will post film online if not paid"
1495132582.0,Independent,India cancelling huge coal power station because it wants to focus on renewable energy - Country wants to become a solar power leader by 2030
1495136448.0,Independent,Conservative manifesto: Theresa May announces UK will remain part of European Convention of Human Rights
1495139656.0,Independent,"Tory manifesto: Conservatives proposing 'Frankenstein’s monster of a plan' for social care, pensioners warn"
1495140635.0,Independent,Japanese princess gives up royal status to marry commoner who worked on beach as tourism promoter
1495132341.0,Independent,"UK Election 2017: Labour slashes Tory lead by five points to hit new campaign high, latest poll shows - Jeremy Corbyn's party has now made up a total of 10 points on the Conservatives since the election was announced"
1495110807.0,Independent,"UK Dementia deaths to nearly quadruple by 2040, scientists warn - Campaigners expressed concern about the quality of care for patients"
1495111796.0,Independent,"UK air pollution deadlier than across half of western Europe, reveals WHO report"
1495124569.0,Independent,"EU plan to relocate 160,000 refugees from Italy and Greece by September failing despite record deaths at sea"
1495093960.0,Independent,India cancelling huge coal power station because it wants to focus on renewable energy
1495093451.0,Independent,Gay Chechens denied US visas after attempting to flee horrors of government crackdown
1495097746.0,Independent,London borough finds one in five child deaths caused by parents being related
1495104370.0,Independent,China sparks human rights outcry by ramping up DNA testing in Muslim-dominated region
1495087171.0,Independent,WhatsApp down: Millions unable to chat after app breaks
1495100363.0,Independent,Tories to cut winter fuel payments for wealthiest pensioners as they launch manifesto
1495086167.0,Independent,UN condemns Hungary's new law targeting foreign-funded NGOs for 'chilling effect' on freedoms and scrutiny
1495075633.0,Independent,Chechnya accused of 'genocide' against gay people in complaint to International Criminal Court
1495075346.0,Independent,"Limitless blood supplies are 'tantalisingly close' to becoming reality, reveal scientists"
1495068527.0,Independent,Poland's Prime Minister says country will accept no refugees as EU threatens legal action over quotas
1495080786.0,Independent,White House says moving Israel embassy to Jerusalem is Trump's 'ultimate goal'
1495067151.0,Independent,Uganda bans Dutch film The Dinner Club for 'glorifying homosexuality' and 'smoking especially by women'
1495070498.0,Independent,Emmanuel Macron names gender-balanced cabinet from across political spectrum
1495042566.0,Independent,German intelligence committee head calls Donald Trump 'a security risk to the Western world'
1495050838.0,Independent,"Vaquita: One of the world's rarest animals could go extinct in months unless Mexico takes action, WWF warns"
1495049229.0,Independent,Theresa May refuses to express 'full confidence' in Donald Trump but says UK will continue sharing intelligence - 'We continue to work with the United States and we continue to share intelligence with the United States'
1495063270.0,Independent,China installs rocket launchers on disputed South China Sea island
1495044380.0,Independent,China sparks human rights outcry by ramping up DNA testing in Muslim-dominated region
1495061596.0,Independent,UK terror plot: Met Police arrest four men in east London on suspicion of planning attack
1495029945.0,Independent,"Donald Trump shared information with Russia on the spur of the moment, says White House"
1495036991.0,Independent,"High possibility of war with North Korea, warns new South Korean president"
1495026350.0,Independent,Theresa May says she supports fox hunting because other ways of killing foxes are 'cruel' - The PM wants to hold a vote on bringing back the animal killings
1495024572.0,Independent,"Dramatic rise in screen time putting children's health at risk, WHO warns. ""It's really a great worried things to all Guardian""."
1495003647.0,Independent,Rodrigo Duterte accepts he could face International Criminal Court over drug killings: ‘This is a democracy’
1494972503.0,Independent,European official says their country might stop sharing intelligence with US if Trump gave classified information to Russia
1494976232.0,Independent,Nato officials will ‘ensure no one talks for more than four minutes to keep Donald Trump’s attention’
1494974437.0,Independent,Nakba: Palestinians marching for 'Day of Catastrophe' wounded in clashes with Israeli army
1494972168.0,Independent,"NHS cyber attack: North Korea is behind hack that brought chaos to hospitals, experts claim"
1494972404.0,Independent,"Landmark Jordanian science centre hopes to bring scientists from Iran, Israel and Palestinians together"
1494921168.0,Independent,"Former Secretary of State John Kerry and other top national security experts are backing an organisation aimed at defending the Iran nuclear deal, as Donald Trump determines for the first time whether to temporarily alleviate some restrictions on the country."
1494892647.0,Independent,Almost half of EU businesses working with British suppliers are already looking to sever ties and find European replacements
1494906938.0,Independent,Russian military to perform observation flights over UK this week
1494849677.0,Independent,"One million hours of UK police time a year 'wasted enforcing cannabis prohibition' - Liberal Democrats want to legalise it, on grounds the ban is an enormous waste of time and money"
1494849877.0,Independent,Second case of Ebola confirmed in Congo after outbreak of 17 suspected infections - World Health Organisation trying to locate 125 people believed to be linked to cases of the disease
1494867743.0,Independent,Philippine politicians begin hearing impeachment complaint against Duterte
1494861296.0,Independent,Mother dies saving daughter's life in car crash on Mother's Day
1494841940.0,Independent,"Pope Francis says he will try to find common ground with Donald Trump when they meet, and not preach"
1494812579.0,Independent,UK Nurses vote overwhelmingly to strike for first time ever over 1% pay rises
1494818242.0,Independent,North Korea willing to meet Trump administration if certain conditions are met
1494816937.0,Independent,Tom Watson admits Tories are on course for landslide general election victory
1494803823.0,Independent,"Tory MP 'told schoolgirl to ""f*** off back to Scotland"" when she said she'd vote for independence' - Conservative candidate James Heappey insists foul-mouthed outburst in front of schoolchildren was ‘intended only as a joke’"
1494794001.0,Independent,"Necropolis containing 17 mummies found in Egypt after laying undisturbed for 1,300 years"
1494797801.0,Independent,NHS cyber attack: UK Defence Secretary unable to deny Government failed to pay to keep NHS systems safe
1494801738.0,Independent,Cyber attack: Fears of surge in ransomware infections as people return to work on Monday
1494750305.0,Independent,"Garden centres selling 'bee-friendly' plants laced with pesticides that harm them, study finds - Just two of the 29 plants tested contained no insecticide or fungicide"
1494748103.0,Independent,Theresa May accused of 'pact of silence' with Donald Trump about US threat to quit Paris climate agreement
1494751374.0,Independent,Metal detectorist rewarded with nearly £2m after unearthing Britain’s biggest Viking treasure - The haul of 100 items has been described by experts 'of outstanding significance'
1494757658.0,Independent,Huge mysterious sea creature washes up on beach in Indonesia
1494732433.0,Independent,"Cyber attack that paralysed NHS hospitals spreads to at least 75,000 people in 100 countries"
1494718751.0,Independent,"EU could be forced to pay Britain a Brexit divorce bill, says Boris Johnson - The former Mayor of London also warned Vladimir Putin could interfere with the general election"
1494696947.0,Independent,"Death of elderly Brexit voters could change second EU vote result, Ian McEwan claims"
1494714242.0,Independent,Amber Rudd says patient records may have been lost in NHS cyber attack - UK Home Secretary admits 'holes' in NHS back-up systems are likely to emerge
1494697028.0,Independent,NHS cyber attack: Large-scale hack plunges hospitals across England into chaos
1494657985.0,Independent,Drug users 'getting Winstoned' by new £5 note as they complain of cut noses when snorting cocaine
1494662526.0,Independent,Refugees in Serbia 'sprayed with insecticide' before forceful eviction
1494643408.0,Independent,Isis gives up Tabqa Dam in deal with US-backed forces advancing on Raqqa: US Central Command conceded its allies held negotiations with jihadists in first publicly acknowledged agreement with ISIS struck by US-backed forces.
1494640172.0,Independent,Spain's parliament votes to move remains of dictator Francisco Franco out of a state-funded mausoleum
1494645478.0,Independent,The Royal Canadian Mounted Police (RCMP) said that it can be dangerous to share posts on social media which feature information and or images of missing children because they may not be lost.
1494605226.0,Independent,"Seventy per cent of migrants to US suffer violence en route, MSF says"
1494585168.0,Independent,"Earth is losing its ice: Glaciers around the world are rapidly disappearing - Millions of people will be forced to leave their homes within a lifetime as sea levels rise, warns expert in article in the world-leading journal Science"
1494586284.0,Independent,"Brexit is already starting to make families poorer, Bank of England warns - Grim economic outlook for 2017 is called 'another sign of the Brexit squeeze', just four weeks before the general election"
1494584897.0,Independent,"British voters overwhelmingly back Labour’s manifesto policies, poll finds - Income tax increases and improved workers rights are among proposals strongly supported by the public, survey shows"
1494569556.0,Independent,"Scientists find whole new planet like our Neptune, potentially revealing the mysteries of the planets"
1494539697.0,Independent,North Korea says it has right to 'ruthlessly punish' captured American citizens
1494507845.0,Independent,"Cafés should be forced to provide free drinking water to cut plastic pollution, says Keep Britain Tidy - A one-litre plastic bottle takes seven litres of water to make and creates the same amount of carbon dioxide as a car driving a kilometre"
1494506987.0,Independent,People with HIV living 10 years longer due to medical advances
1494518607.0,Independent,"Theresa May pledges to increase defence spending after military chiefs warn UK losing the ability to fight wars - 'The armed services are having to seek further very damaging savings in manpower, support and training at a time when the likelihood of combat operations is increasing'"
1494504531.0,Independent,Brexit: Number of foreign tech job applications down 50% since EU referendum vote - Overseas candidates are already seeking employers outside of the UK
1494494386.0,Independent,"Mexico had the second-highest number of murders last year among countries considered in “armed conflict,” more than Iraq and Afghanistan, according to a new report."
1494461676.0,Independent,Theresa May refuses to apologise for Conservative expenses scandal: 'Our candidates did nothing wrong'
1494466120.0,Independent,"President Trump’s decision to provide weapons to the Syrian Kurds, who are fighting Isis, potentially marks a crucial change in the political geography of the Middle East. In effect, the US is choosing to support its Kurdish ally in Syria, in defiance of Turkey"
1494447378.0,Independent,Labour will scrap university tuition fees if they win general election
1494450553.0,Independent,Bernie Sanders is touring the UK. Senator Bernie Sanders will speak at venues across the UK next month [... ] just days before the General Election.
1494451414.0,Independent,Russian President Vladimir Putin tells Red Square: No one can defeat our military
1494443172.0,Independent,Tory election expenses investigation: Jeremy Corbyn says he is 'surprised' MPs face no charges and 'money can’t buy power'
1494450846.0,Independent,German soldier arrested over 'false flag' plot to assassinate left-wing politicians in terror attack
1494429926.0,Independent,"Theresa May 'refusing to take press questions she hasn't pre-approved', claims Michael Crick - Channel 4 political correspondent says member of Prime Minister's campaign team told him not to bother raising his hand as he 'wasn’t on the list'"
1494430612.0,Independent,"Emmanuel Macron blames 'homophobia' and 'misogyny' for obsession with his older wife - New French President claims that if his wife was 20 years younger than him, nobody would question their relationship"
1494430758.0,Independent,Jeremy Corbyn pledges £20bn for schools revolution by scrapping Tory plan to cut corporation tax - The Labour leader said the money would pay for a new 'National Education Service' for the UK
1494434067.0,Independent,Venezuela: Cases of malaria surge 76% and infant mortality spikes amid national crisis
1494418458.0,Independent,Second German soldier arrested over 'false flag' plot to assassinate left-wing politicians in terror attack
1494418857.0,Independent,UK Cumbrian council renews licence for zoo where almost 500 animals died in four years - Barrow-in-Furness voted to allow zoo to stay open despite protests from animal rights campaigners
1494395242.0,Independent,"Almost 10,000 Yazidis ‘killed or kidnapped in Isis genocide but true scale of horror may never be known’"
1494373174.0,Independent,"Winged dinosaur the size of an elephant once lived in China, scientists discover"
1494378951.0,Independent,Stephen Fry blasphemy investigation prompts New Zealand to repeal its law
1494386010.0,Independent,Donald Trump to arm Syrian Kurds against Isis despite Turkish opposition
1494373177.0,Independent,Bouncy castle ‘explosion’ kills six year-old girl and injures six children
