Created,Domain,Title
1492661570.0,CBC,"Teen girls were 'humiliated' after sexually explicit photos were shared, says victim - Nova Scotia"
1492601914.0,CBC,Asteroid to make close pass to Earth on Wednesday
1492563086.0,CBC,Massive iceberg on Newfoundland's Southern Shore attracts shutterbugs - Newfoundland & Labrador
1492514157.0,CBC,Climate change causes glacial river in Yukon to change direction
1492487395.0,CBC,Turkish opposition urges cancellation of referendum result -- International observers who monitored the voting also found irregularities
1492478024.0,CBC,U.S. customs release image of 'mock IED' that caused hours of delays at Pearson - Toronto
1492307072.0,CBC,China warns against war amid North Korea's parade of military might
1492257681.0,CBC,Police Draw Guns On Man In Fallout Costume
1492256253.0,CBC,North Korea displays submarine-based missiles for first time at military parade
1492211857.0,CBC,"Canada announces sanctions on 27 top Syrian officials in effort to pressure Assad - The Syrian officials are now subject to an asset freeze & dealings prohibition, says Chrystia Freeland"
1492199640.0,CBC,"North Korean official says U.S. more vicious, aggressive under Trump"
1492144399.0,CBC,Newfoundland couple finds cameras in their apartment.
1492134665.0,CBC,First Nations aim to capitalize on economic opportunity of legal pot industry
1492129325.0,CBC,Canada's Liberals table bill to legalize pot by 2018
1492107742.0,CBC,"Police warn organized crime, including the Hells Angels, has infiltrated the medical marijuana market (Canada)"
1492117672.0,CBC,China says military force in Korean Peninsula unacceptable as U.S. warships near
1492073727.0,CBC,Russia vetoes UN resolution to condemn Syria chemical attack
1492027936.0,CBC,"Migrants in Libya are being rounded up and sold into slavery, UN says"
1492016870.0,CBC,Girls' education activist Malala Yousafzai to address Parliament today
1491960046.0,CBC,North Korea warns of nuclear attack on U.S. at any sign of aggression
1491943891.0,CBC,'We'll find her soon': Quebec woman target of online hate for boycotting Trump products
1491722494.0,CBC,Warplanes strike Syrian town hit by chemical attack last week - World
1491610065.0,CBC,Russian PM says U.S. Syria strikes '1 step away' from clashing with Russia
1491612525.0,CBC,The threat of four famines has aid groups offering cash directly to those who need it
1491589637.0,CBC,U.S. missile strikes at Syria base 'in violation of international law': Putin
1491444704.0,CBC,"Devices that track, spy on cellphones found at Montreal's Trudeau airport"
1491406800.0,CBC,'Clearly a war crime': International community denounces chemical attack in Syria but fails to act
1491304699.0,CBC,3 tigers rescued from maggot-infested crate in Beirut airport
1491296183.0,CBC,Malala Yousafzai to address Canadian Parliament and receive honorary citizenship April 12 - Politics - CBC News
1491279446.0,CBC,NHL announces it will not participate in 2018 Olympics.
1491282893.0,CBC,A CBC/Radio-Canada investigation has found cellphone trackers at work near Parliament Hill and embassies
1491274757.0,CBC,Bell Island rallies to rescue trapped dolphins; whale stuck in Old Perlican dies
1491100521.0,CBC,More than 100 people killed in Colombia flooding
1491083273.0,CBC,Canada extends ISIS mission in Iraq to June 30.
1491041174.0,CBC,Russia's Putin says climate change in Arctic good for economy
1491006980.0,CBC,Suicide bomber kills 24 near Shia mosque in Pakistan
1491011199.0,CBC,"Scotland formally requests referendum, U.K. plans to deny it"
1490993930.0,CBC,Few signs of Canadian investigation into Abu Sayyaf beheadings in Philippines
1490990059.0,CBC,Teacher suspended for mock ISIS photo depicting himself and ex-gf
1490856053.0,CBC,New Zealand man challenges environment minister to a fist fight over water pollution policy
1490777766.0,CBC,Labrador man denied entry to U.S. accuses border guard of racial profiling
1490761776.0,CBC,"Supermassive black holes give birth to stars, astronomers discover"
1490763150.0,CBC,"Cyclone Debbie leaves thousands without power in Queensland, Australia"
1490732397.0,CBC,Netflix's anti-piracy team aims to make stealing content uncool
1490703906.0,CBC,Canadian court rules Sinixt First Nation not 'extinct' after all
1490688722.0,CBC,Hong Kong protest leaders arrested in wake of election
1490644543.0,CBC,"'We are ready': Canada-Europe trade deal set to kick in, mostly, by July 1"
1490606571.0,CBC,"Canada to announce marijuana will be legal by July 1, 2018"
1490605381.0,CBC,canadians breezing across border to usa faster than ever
1490482189.0,CBC,Grabher licence plate revoked
1490407602.0,CBC,Keystone XL pipeline gets OK from U.S. State Department - Business
1490320199.0,CBC,Keystone XL pipeline to get U.S. approval by Monday
1490258521.0,CBC,Justin Trudeau's trip to Aga Khan's Bahamas island cost more than $127K
1490252909.0,CBC,Ukraine bans Russia's entry to Eurovision Song Contest
1490233271.0,CBC,Justin Trudeau's trip to Aga Khan's Bahamas island cost more than $127K
1490200247.0,CBC,"Cut out the cardboard cut-outs of Trudeau, Canadian diplomats told"
1490155164.0,CBC,Quebec premier lashes out at Maclean's for suggesting province is in state of 'serious dysfunction'
1490145449.0,CBC,"New ban targets carry-on laptops, tablets on U.S. and U.K.-bound jets from Mideast, North Africa"
1490143877.0,CBC,Sunwing pilot pleads guilty after passing out drunk in cockpit
1490101591.0,CBC,"Archeologists find 400,000-year-old cranium fossil related to Neanderthal"
1490087464.0,CBC,"Failing to extradite pair for 'honour killing' trial in India would undermine global justice, Canadian government lawyer says"
1490048584.0,CBC,Trump says Russian hacking allegations 'made up' ahead of FBI director's testimony
1490051884.0,CBC,Canada has detained more Mexicans in 2 months than in all of 2016
1489966012.0,CBC,Traces of Earth's original crust found in Canadian Shield
1489971675.0,CBC,"Canadian Senator who defended residential schools stands by remarks, cites 'fake news'."
1489937482.0,CBC,Canada has detained more Mexican refugees in two months than in all of 2016
1489932472.0,CBC,Peru braces for more flooding after at least 72 deaths
1489917555.0,CBC,"Trump order on conflict minerals would send warlords carte blanche signal, say critics"
1489856443.0,CBC,"Corner Brook woman in Costa Rican 'cult', says family pleading for her return"
1489818849.0,CBC,Canada to give $119M in aid to Middle East and African countries suffering food crises
1489825783.0,CBC,Missing Canadian woman found as part of Costa Rican cult
1489789066.0,CBC,Even some one-percenters are finding home ownership is out of reach in Toronto
1489752222.0,CBC,At least a dozen die in new round of flooding in Peru
1489707944.0,CBC,Canadian defence spending among lowest in NATO despite small increase last year
1489693845.0,CBC,"Aydin Coban sentenced in Dutch court to 10 years for online fraud, blackmail"
1489659803.0,CBC,Canadian nurses working at Michigan hospitals were stopped from entering the U.S. due to changes to their working visas under Trump's new immigration policies
1489627130.0,CBC,'We are all doing it': Employees at Canada's 5 big banks speak out about pressure to dupe customers
1489632379.0,CBC,"'An angel, not Satan, escaped from your hell,' aunt of boy abused by ex-Mountie tells court"
1489513665.0,CBC,Canadian volunteers denied entry to U.S. so they wouldn't 'steal American jobs'
1489531864.0,CBC,Border-crossing bears? U.S. proposal to transplant B.C. grizzlies gets huge response
1489492422.0,CBC,Canadian church volunteers denied entry to U.S. so they wouldn't 'steal American jobs'
1489497566.0,CBC,Hamilton church volunteers denied entry to U.S. so they wouldn't 'steal American jobs' - Hamilton - CBC News
1489497547.0,CBC,Carleton University is facing online backlash after removing the gym scale in order to promote a more holistic approach to a healthy body image.
1489477080.0,CBC,"Girl Guides of Canada cancelling trips to the U.S., citing travel concerns"
1489475545.0,CBC,Ottawa-based sex toy maker settles privacy lawsuit for $5M
1489464725.0,CBC,Girl Guides of Canada cancelling trips to the U.S. citing travel concerns
1489425826.0,CBC,Battle to liberate Mosul from ISIS gains ground
1489363248.0,CBC,NB's electoral reform commission proposes preferential ballot
1489098064.0,CBC,Ivanka Trump brand claims sales are booming despite boycott
1489096785.0,CBC,David and Collet Stephan invite supporters to court for appeal conviction in son's meningitis death - Calgary
1489059348.0,CBC,Liberal backbenchers defy cabinet wishes and vote to enact genetic discrimination law
1489057442.0,CBC,U.S. border agents under microscope after Canadians denied entry
1489043371.0,CBC,Canadian Tory leadership candidate Kellie Leitch wants immigrants to be asked: 'Are men and women equal?'
1488968400.0,CBC,"'Inadequate and unsafe' Inuit housing needs national fix, say senators"
1488918661.0,CBC,Tory leadership candidate Kellie Leitch wants immigrants to be asked: 'Are men and women equal?'
1488927575.0,CBC,Conservative government considers mandatory breathalyzer interlocks for ALL vehicles.
1488903716.0,CBC,U.S. responds to North Korea by readying anti-missile defence system across border - World
1488844438.0,CBC,"Canadian woman en route to spa denied entry to U.S., told she needs immigrant visa"
1488761767.0,CBC,"""Street View"" for the ocean helping in the fight to save coral reefs"
1488724908.0,CBC,"Ancient monument in Syrian city of Palmyra damaged by ISIS, expert says"
1488669130.0,CBC,"2 moose riders fined $4,000 for harassing wildlife in northern B.C. lake"
1488580503.0,CBC,Russia's 'most dangerous diplomat' becomes central figure in Trump team's ties to Moscow
1488516564.0,CBC,Montreal man charged with terror hoax after bomb threat targeting Muslim university students
1488462652.0,CBC,"Subways defends its chicken: calls story ""false and misleading"""
1488429570.0,CBC,Oldest traces of life on earth found in Quebec
1488354565.0,CBC,"Bahamas' Famous Swimming Pigs Found Dead, and Tourists May Be to Blame"
1488324881.0,CBC,"Friendship on the rocks? China, North Korea clash over nuclear and chemical weapons"
1488280935.0,CBC,Ottawa paramedics boosting supply of opioid antidote naloxone
1488246364.0,CBC,"The World Health Organization warned on Monday that a dozen antibiotic-resistant “superbugs” pose an enormous threat to human health, and urged hospital infection-control experts and pharmaceutical researchers to focus on fighting the most dangerous pathogens first."
1488155923.0,CBC,High rent could make Toronto a 'generational ghost town' - Toronto
1488153657.0,CBC,"ISIS threat in U.K. high, says new terrorism watchdog - World"
1488155046.0,CBC,Mikael Kingsbury strikes gold again in World Cup moguls
1488096210.0,CBC,Canada's Public Safety minister to raise issue of illegal border crossings with U.S. officials
1488063928.0,CBC,Businessman from China investing in Vancouver real estate ordered to repay millions
1488003161.0,CBC,Raditas guilty of 1st-degree murder of teen son who weighed 37 lbs. at death.
1487991556.0,CBC,"New species of gigantic, toothy worm identified in Canadian fossil collection.400-million-year-old fossil specimen has been in Royal Ontario Museum collection since 1994"
1487959861.0,CBC,Drug gangs take back control of slums in financially crippled post-Olympic Rio
1487788225.0,CBC,"Canada plans to resettle 1,200 Yazidi refugees and other survivors of ISIS by the end of this year"
1487801849.0,CBC,CRA's new fingerprinting policy could create travel problems for accused tax evaders
1487736898.0,CBC,"Canada isn't About To Throw Mexico Under The Bus, Foreign Ministers Say - Politics"
1487647914.0,CBC,"Quebec increases maple syrup production amid internal revolt, foreign competition"
1487625205.0,CBC,Millions at risk as famine grips parts of South Sudan
1487598781.0,CBC,RCMP help asylum-seeking family through snow after run-in with U.S. border patrol
1487590121.0,CBC,Refugee Claimants Fleeing the US for Canada
1487546861.0,CBC,"Dozens of asylum seekers, baby, cross into Manitoba Sunday - The refugee claimants fleeing the United States are the latest to cross into Canada"
1487503804.0,CBC,Police investigate anti-Muslim rally outside Toronto mosque as possible hate crime
1487459586.0,CBC,Trudeau says Canada one of NATO's 'strongest actors' without committing more money
1487398645.0,CBC,Suspect involved in Kim Jong Un's assassination claims she thought it was a Just For Laughs-type gag
1487407183.0,CBC,Bomb shelter sales skyrocket in response to Trump presidency
1487295603.0,CBC,"Children with ADHD have some smaller brain regions, study shows"
1487246355.0,CBC,"China to regulate carfentanil and three related synthetic opioids , seen as 'substantial step' in curbing opioid exports and Fentanyl crisis"
1487235149.0,CBC,"Partners in parenting, but not love: Singles pair up to raise a child"
1487213183.0,CBC,Pope Francis says Indigenous people have rights over their lands.Pope doesn't cite Dakota pipeline by name as Trump seeks to advance its construction
1487220715.0,CBC,"Partners in parenting, not love: Singles pair up to raise a child"
1487146729.0,CBC,Canadian Liberals move to write off $178 million in unpaid federal student loans
1487154801.0,CBC,"Sikh extremist, The only person convicted in the Flight 182 bombing resulting in 331 deaths, the largest mass murder in Canadian history, released from a halfway house"
1487036790.0,CBC,Justin Trudeau meets Donald Trump at Whitehouse
1487037071.0,CBC,Hamas names shadowy militant as new leader in Gaza
1487032922.0,CBC,"Trump, Trudeau to discuss women in workforce at Washington round table"
1486991743.0,CBC,Child sex doll trial opens Pandora's box of questions about child porn
1486997243.0,CBC,"North Korea missile test prompts UN Security Council meeting on Monday North Korea may have achieved significant advancement in missile development, expert says"
1486974309.0,CBC,PayPal freezes Canadian media company's account over story about Syrian family - Manitoba (Canada)
1486908776.0,CBC,Trump says U.S. 100% behind Japan as PM Abe condemns North Korea missile launch
1486886241.0,CBC,27 asylum seekers crossed into Manitoba Saturday.
1486796085.0,CBC,"Canadian man who beheaded passenger on Greyhound bus, given absolute discharge"
1486764022.0,CBC,Storm of reaction to news Syrian refugee charged with sex assaults in Canada
1486758801.0,CBC,16 year old girl among four arrested for allegedly plotting attack in Paris
1486696892.0,CBC,Radiation levels discovered at crippled Fukushima plant too high for robot
1486694083.0,CBC,Justin Trudeau and Donald Trump to meet Monday in Washington
1486679344.0,CBC,"'Informal' network helping refuge seekers get to Manitoba, U.S. officials say"
1486644494.0,CBC,"Toronto man, missing for 5 years, found wandering on Brazilian highway"
1486621078.0,CBC,"Canadian woman turned away from US border after questions about religion, Trump"
1486535193.0,CBC,Nearly two-dozen refugees walk over Canadian border from U.S.
1486464273.0,CBC,Avalanches in Afghanistan kill at least 119
1486274100.0,CBC,Ontario to provide life-saving health care to children affected by U.S. travel ban - Toronto
1486271508.0,CBC,Students affected by U.S. travel ban can apply for free at University of Calgary
1486224756.0,CBC,In his own words: Imam Hassan Guillet's address at Quebec City funeral for 3 mosque victims - Montreal
1486188607.0,CBC,Canada looking at legality of enforcing Trump travel ban on Canadian soil
1486200561.0,CBC,Some Nexus cards revoked on both sides of border following U.S. executive order
1486193224.0,CBC,'What kind of life is this?': Visiting residents of eastern Ukrainian town in their artillery-blasted homes
1486173871.0,CBC,"Jews, Christians to form protective 'rings of peace' around Toronto mosques today - CBC.ca"
1486185851.0,CBC,Ontario to provide life-saving healthcare to children affected by U.S. travel ban
1486167020.0,CBC,U.S. sanctions Iran over ballistic missile test
1486177090.0,CBC,Liberal fears of proportional representation and a referendum killed Trudeau's reform promise
1486172334.0,CBC,"Putin's thorn: Alexei Navalny, Russia's foremost opposition activist, risks jail again - World"
1486135077.0,CBC,Canadian court rules that insurance companies must cover medical marijuana.
1486126629.0,CBC,"Wall of manure created just to make neighbours miserable, Moncton judge finds"
1486132291.0,CBC,New Canadians to pledge honour for Indigenous treaties in revised citizenship oath
1486116068.0,CBC,Researchers confirm 'lost continent' below Mauritius
1486073749.0,CBC,'It's so much worse': Renewed fighting in Ukraine pushes town to brink of humanitarian catastrophe
1486025746.0,CBC,Study suggests we're living in a holographic universe
1486001129.0,CBC,Canadian Government abandons electoral reform promise
1486000912.0,CBC,Trudeau government abandons promise of electoral reform
1485992795.0,CBC,Quebec City mosque posts video showing bloody scene after deadly shooting
1485992304.0,CBC,Chinese-Canadian billionaire missing from Hong Kong
1485988604.0,CBC,Sharkwater filmmaker Rob Stewart missing at sea
1485961780.0,CBC,Ban Ki-moon rules out presidential run in South Korea
1485966257.0,CBC,Incorrect Fox News tweet on Quebec City mosque attack earns scorn of PMO
1485933554.0,CBC,"Legalizing all drugs would be good for Canada, according to Toronto Liberal MP - Toronto"
1485940536.0,CBC,"Asylum seekers surge into Manitoba, with 10 refugee claims on Monday alone"
1485919423.0,CBC,Witness arrested in Quebec mosque shooting isn't holding a grudge
1485908485.0,CBC,"Lift Canada's refugee cap in wake of Trump travel ban, Canadian MP says"
1485887659.0,CBC,At least 7 killed as fighting in Ukraine intensifies again - World
1485892615.0,CBC,Quebec City mosque shooting victims identified.
1485813056.0,CBC,'Stand in solidarity': Canadian residents open their homes to those stranded by U.S. travel ban
1485779481.0,CBC,Canadian troops coming to N.B.'s aid
1485686758.0,CBC,British PM Theresa May talks trade post-Brexit in Turkey visit
1485618281.0,CBC,Canada to increase reproductive health funding in response to Trump decision
1485508089.0,CBC,"Torture 'counter to our values,' say Canadian military commanders"
1485510385.0,CBC,"Canada could be a world leader in nuclear fusion by 2030, report suggests"
1485507065.0,CBC,TransCanada submits new application for Keystone XL pipeline
1485483990.0,CBC,Canadian justice minister plans to review 'zombie laws' after Travis Vader trial
1485302453.0,CBC,Netanyahu to meet with Trump before calling vote on West Bank annexation
1495604714.0,CNN,US officials: Navy SEALs kill 7 militants in Yemen raid
1495583375.0,CNN,Ex-CIA chief John Brennan: 'Russia brazenly interfered' in US elections
1495599057.0,CNN,US officials: Navy SEALs kill 7 militants in Yemen raid
1495565208.0,CNN,"Trump asked DNI, NSA to deny evidence of Russia collusion"
1495492290.0,CNN,"Iran accuses US of 'Iranophobia', 'warmongering' after Trump's Saudi visit"
1495479395.0,CNN,"Philippines President Rodrigo Duterte will depart on an official five-day visit to Moscow Monday, as part of an effort to realign his country's foreign policy away from longtime ally the United States."
1495494072.0,CNN,Jakarta police raid gay sex party amid crackdown on LGBT Indonesians
1495474353.0,CNN,Philippines' Duterte looks to strengthen ties with trip to Moscow
1495469113.0,CNN,Trump heads to Israel in search of 'ultimate deal' Trump heads to Israel in search of 'ultimate deal
1495444561.0,CNN,Immigrants eye Canada as US deportation fears grow
1495323173.0,CNN,"In victory for moderates, Iranian President Hassan Rouhani wins re-election"
1495317684.0,CNN,"Saudi Arabia, US companies reach $55 billion in deals"
1495321019.0,CNN,"Saudi Arabia, US companies reach $55 billion in deals"
1495271911.0,CNN,"Russian officials bragged they could use Flynn to influence Trump, sources say"
1495222713.0,CNN,Japan: China 'escalating' tensions over disputed islands
1495175140.0,CNN,'We are the market': Tillerson faults US for evils of Mexico's drug trade
1495191566.0,CNN,Chinese fighter flies inverted over US Air Force jet
1495183214.0,CNN,US Navy moves second aircraft carrier near North Korea
1495190168.0,CNN,US summoned Turkish ambassador after protester violence
1495162771.0,CNN,US-led coalition airstrikes targeted Syrian regime forces
1495137763.0,CNN,6 dead in ISIS attack on TV station in Afghanistan
1495117010.0,CNN,Venezuelans lost an average of 19 pounds each from hunger in 2016.
1495117251.0,CNN,Ferry between Russia and North Korea starts regular service
1495114934.0,CNN,Dutch King reveals he piloted KLM passenger flights
1495124303.0,CNN,Venezuela: Where supplies are few and pain is everywhere
1495118691.0,CNN,Dutch King reveals he piloted KLM passenger flights
1495082962.0,CNN,"First on CNN: ISIS creating chemical weapons cell in new de facto capital, US official says"
1495020841.0,CNN,Beirut gay pride event a first for Lebanon
1494992855.0,CNN,Austria set for snap election
1494971323.0,CNN,Beirut gay pride event a first for lebanon
1494972167.0,CNN,"WHO: 1.2 million adolescents' deaths mostly preventable, report says"
1494968091.0,CNN,Egypt proposes national registration system and state monitoring for Social Media access (Facebook)
1494917236.0,CNN,"Over 800 cancer patients have joined a class action suit against Monsanto, the maker of Roundup, claiming the company failed to warn consumers about the risk of cancer associated with Roundup products."
1494917562.0,CNN,CNN : North Korea offers 'extended middle finger' to Trump
1494923646.0,CNN,Disabled voter confronts Theresa May about benefit cuts
1494896100.0,CNN,"State Dept.: Assad using crematorium to hide atrocities - The US said Monday it believes the Syrian government has built a large crematorium near the notorious Saydnaya Military Prison in an effort to hide mass atrocities carried out there, in newly unveiled declassified intelligence."
1494902358.0,CNN,Top US officials warn Trump against moving US embassy to Jerusalem
1494883399.0,CNN,Putin warns against 'intimidating' North Korea
1494869843.0,CNN,"Ebola kills 3 in DRC, WHO says; scores more linked to deaths"
1494849527.0,CNN,Duterte follows Xi's lead with military build-up in South China Sea
1494849432.0,CNN,Half of Macron's poll candidates are women
1494819946.0,CNN,Putin performs unexpected piano recital in Beijing
1494794220.0,CNN,"North Korea blights China's One Belt, One Road party with missile launch"
1494774994.0,CNN,South Korea's new president questions Japan 'comfort women' deal
1494778835.0,CNN,"China's and Russia's new world order. ""Protectionism is becoming the new normal,"" Putin warned, ""ideas of openness and free trade are increasingly often being rejected (even)."
1494776762.0,CNN,On the frontline of ISIS' last stand in Iraq
1494751737.0,CNN,"A Russian military jet ""came within approximately 20 feet"" of a US Navy P-8A Poseidon surveillance plane while it was flying in international airspace over the Black Sea earlier this week, US Navy Capt. Pamela Kunze told CNN on Friday."
1494753562.0,CNN,Russian money-laundering details remain dark as US settles fraud case - The case aimed to expose how Russian mobsters allegedly stole $230 million and hid some of the cash in New York City real estate.
1494755506.0,CNN,"China's new world order: Xi, Putin and others meet for Belt and Road Forum"
1494736781.0,CNN,Report: North Korean diplomat open to US talks
1494660718.0,CNN,UK prime minister: Ransomware attack is global
1494640650.0,CNN,Venezuela health minister fired after revealing data showing 66% rise in maternal deaths
1494645727.0,CNN,Venezuela health minister fired after revealing data showing 66% rise in maternal deaths
1494637560.0,CNN,North Korea wants South's spy chief extradited over alleged Kim plot
1494642725.0,CNN,A rare inside look at the Chibok girls' road to recovery
1494577796.0,CNN,"White House furious after being trolled with Russia Oval Office photos - ""They tricked us,"" an angry White House official said. ""That's the problem with the Russians -- they lie,"" the official added. The Russians used the photos to troll the White House in its social media posts Wednesday."
1494574172.0,CNN,US approves $2 billion arms deal to UAE
1494525229.0,CNN,Dozens killed as wall collapses at wedding in India
1494536406.0,CNN,A rare inside look at the Chibok girls' road to recovery
1494521811.0,CNN,"Daughter, father, future doctor: Victims of unrest in Venezuela"
1494496750.0,CNN,"Mexico was second deadliest country in 2016, second only to Syria"
1494496718.0,CNN,Election brings new North Korea-US dynamic
1494451995.0,CNN,Mexico was second deadliest country in 2016
1494442115.0,CNN,Australian senator makes history by breastfeeding her baby in Parliament
1494445190.0,CNN,South Korea election: Moon Jae-in declared winner
1494407812.0,CNN,CNN exclusive: Grand jury subpoenas issued in FBI's Russia investigation
1494414437.0,CNN,Trump to meet with Russian Foreign Minister Lavrov Wednesday
1494408853.0,CNN,Canadian journalist asked to leave 'Kushner family event' in China
1494392530.0,CNN,Early human species likely lived alongside us
1494378755.0,CNN,Mexico was second deadliest country in 2016
1494379333.0,CNN,USS Ronald Reagan headed to Pacific
1494375714.0,CNN,South Korea election: Moon Jae-in claims victory
1494389566.0,CNN,"Tillerson, Lavrov to meet in Washington on Syria and Ukraine"
1494360351.0,CNN,South Korea election: Exit poll points to Moon Jae-in win
1494340038.0,CNN,Study finds EpiPens are still potent 4 years after expiration date
1494332587.0,CNN,Putin visits former KGB boss on eve of Victory Day
1494327339.0,CNN,School bus crash kills 36 in Tanzania
1494327946.0,CNN,82 Chibok schoolgirls released in Nigeria
1494199749.0,CNN,School bus crash in Tanzania kills 36 people
1494191269.0,CNN,US citizen detained in North Korea
