Created,Domain,Title
1493262806.0,Telegraph,Turkey bombs Kurdish forces in Syria
1493240155.0,Telegraph,"Turkey arrests 1,000 'secret imams' in latest crackdown"
1493225088.0,Telegraph,"Mexican wolf born using frozen sperm offers new hope for endangered species: The Mexican wolf population once roamed Mexico & the western US in the thousands but was nearly wiped out by the 1970s due to hunting, trapping & poisoning."
1493209864.0,Telegraph,Gold Darth Vader mask to go on sale for £1m to mark Star Wars Day
1493173036.0,Telegraph,"Passengers want thin stewardesses, say Aeroflot representatives"
1493159776.0,Telegraph,'Paedophile hunters' arrested by police as officers begin crackdown on social media vigilantes
1493081857.0,Telegraph,'Mass is cancelled because of a lack of parishioners': Historic churches in Venice close down as faithful dwindle
1493092975.0,Telegraph,Marine Le Pen steps down as leader of France's Front National in bid to widen appeal ahead of presidential election
1493073343.0,Telegraph,'A laughing man with an axe killed my family' says 22-year-old accused of murdering his parents and brother
1493056465.0,Telegraph,"Bomb left at a Belfast school was an attempt to murder police, officer says"
1493075188.0,Telegraph,Pictures reveal inside of Afghan caves at 'Mother of All Bombs' blast site
1493048161.0,Telegraph,"Half of England's Anglican cathedrals could close amid funding crisis - Anglican cathedrals could be forced to charge for entry or face closure, amid dwindling public funding and expensive running costs."
1492976959.0,Telegraph,Japanese ships join US carrier for drills as it nears Korean waters
1492960020.0,Telegraph,Australia opposed to resuming search for missing MH370 aircraft
1492924923.0,Telegraph,Revealed: How Britain’s former Syria ambassador appeared on BBC to defend Assad... after quietly taking a job with dictator’s father-in-law
1492866936.0,Telegraph,UN voices fears of ‘catastrophic nuclear accident’ as global tensions increase
1492851620.0,Telegraph,Marine Le Pen gets poll boost after Paris attack as Donald Trump says her chances of victory have improved
1492766421.0,Telegraph,Paris attack: police officer and suspect shot dead on Champs Elysees in attack claimed by Islamic State
1492708008.0,Telegraph,Mark Zuckerberg confirms Facebook is working on mind-reading technology
1492668477.0,Telegraph,Bangkok to ban its famous street food stalls.
1492642179.0,Telegraph,"Police have voiced concern about self-styled ""paedophile hunters"" who set up undercover sting operations amid fears they are interfering in their work and potentially entrapping innocent people."
1492628382.0,Telegraph,Police warn against Facebook 'paedophile hunters' who are streaming live 'stings' online
1492638071.0,Telegraph,Asteroid the size of Gibraltar rock to pass very close to Earth - An asteroid the size of the Gibraltar rock will be the largest asteroid to come this close to Earth since 2004.
1492632589.0,Telegraph,Syrian photographer puts down his camera to carry wounded children to safety
1492630323.0,Telegraph,"Prince Harry: I sought counselling after 20 years of not thinking about the death of my mother, Diana, and two years of total chaos in my life"
1492561386.0,Telegraph,British intel 'tipped off' French over 'imminent' election terror attack as guns and bomb materials found
1492543036.0,Telegraph,Three children racially abused and spat at as they walk home from adventure playground in north London
1492520686.0,Telegraph,Foreign criminals and failed asylum-seekers could be removed from Britain within 25 days under a new fast-track appeal system.
1492425975.0,Telegraph,China and Russia dispatch ships to shadow Donald Trump’s 'Armada' as it approaches North Korean waters
1492372499.0,Telegraph,China appeals for Russia's help to avert a possible North Korea crisis
1492367078.0,Telegraph,North Korea's unsuccessful missile launch 'may have been thwarted by US cyber attack'
1492324883.0,Telegraph,Zimbabwe plans to secure bank loans with cows
1492324744.0,Telegraph,"Foreign interests trying to subvert my rule, says Hungary's Viktor Orban, amid protests"
1492324809.0,Telegraph,World Bank chief plays down prospect of €3bn Greek loan
1492324433.0,Telegraph,UK foreign secretary offers Russia a deal to end Syria crisis saying ‘they still have time to be on the right side of the argument’
1492270935.0,Telegraph,Jean-Luc Mélenchon promises 'no Red Army tanks' in France if he wins presidency after spectacular late surge
1492242197.0,Telegraph,UK Foreign Office attacked by Russia-linked cyber hackers
1492254401.0,Telegraph,North Korea uncovers submarine-based missiles for the first time as nuclear tensions with US rise.
1492198288.0,Telegraph,"Imminent Nuclear War Threat - World 'on the brink of thermo-nuclear war', as North Korea mulls test that could goad Trump"
1492119267.0,Telegraph,Nasa to make major announcement about Saturn and alien life
1492085701.0,Telegraph,Foreign journalists in North Korea gather for 'big and important event' amid tensions
1492087824.0,Telegraph,"Soaring house prices are reducing the number of babies born in England because fewer people can afford their own home and so delay starting a family, a new study suggests."
1492025126.0,Telegraph,Borussia Dortmund explosions: Police examine 'Islamist' letter 'naming Angela Merkel' after bus bombing
1491926379.0,Telegraph,Belgian psychologist who worked with failed asylum seekers among Stockholm terror victims
1491726038.0,Telegraph,"Stockholm attack driver 'deliberately targeted young children' as he drove hijacked lorry into crowd, witnesses claimed"
1491722289.0,Telegraph,Brexit poll: Eurosceptics think ending EU payments more important than stopping free movement
1491715316.0,Telegraph,Boris Johnson cancels Russia trip just hours before take-off after US air strike on Syria
1491641709.0,Telegraph,Sweden truck attack suspect 'is 39-year-old from Uzbekistan who posted jihadist propaganda'
1491639238.0,Telegraph,China and the United States 'agree to greater cooperation' in curbing North Korea's nuclear ambitions
1491646434.0,Telegraph,Xi Jinping told Donald Trump he understood the US response 'because of the death of children'
1491610196.0,Telegraph,Syrians hail Donald Trump as their new champion: Abu Ivanka al-Amriki
1491575582.0,Telegraph,"Trump alerting Russia about Syria strike ""may have led to Russia alerting Syria, and the scrambling of jets from Shayra;"" a warehouse at Shayra was thought to contain chemical weapons ""but that was avoided"""
1491583465.0,Telegraph,British DJ sentenced to jail in Tunisia over dance remix of the Muslim call to prayer
1491465902.0,Telegraph,Nicola Sturgeon says Scotland's independence campaign 'an example for the world' during UN visit
1491466480.0,Telegraph,Theresa May defends George Osborne's decision to become Evening Standard editor while an MP
1491444846.0,Telegraph,Bomb explosion in Bangkok near Khoasan road killing 20 and injuring 123.
1491428124.0,Telegraph,Briton jailed for three decades in US gets chance to prove innocence
1491396499.0,Telegraph,Theresa May takes stand against Saudi regime by not wearing headscarf - ignoring Foreign Office advice
1491377780.0,Telegraph,eBay founder Pierre Omidyar commits $100m to fight 'fake news' and hate speech
1491349760.0,Telegraph,Royal Navy chases Spanish patrol boat out of waters off Gibraltar as Nigel Farage says UK must not be 'bullied'
1491325340.0,Telegraph,Syria 'gas attack': Nine children among at least 35 people reported killed in Idlib
1491265478.0,Telegraph,Theresa May warns Donald Trump against unilateral action on North Korea
1491251458.0,Telegraph,Royal Navy 'far weaker' than it was during Falklands War
1491222933.0,Telegraph,Dream of swimming with dolphins? Think again as travel company drops tours amid cruelty fears
1491179667.0,Telegraph,Fears in India over spread of 'Taliban-like' moral policing amid crackdown on meat and romance
1491155417.0,Telegraph,Leaked minutes of Brexit cabinet committee meeting show UK ministers plotted to exploit EU’s fear of Vladimir Putin during Brexit talks
1491161476.0,Telegraph,Theresa May 'would go to war' to defend the sovereignty of Gibraltar
1491157168.0,Telegraph,Airport mix-up sees Winter Olympics delegation land in Pyongyang after pilot files wrong flight plan
1491169662.0,Telegraph,"Abu Hamza’s son, stripped of British passport after waging jihad in Syria, told of his “surprise” at his passport being revoked."
1491135506.0,Telegraph,Madeleine McCann investigator claims her kidnappers are being protected
1491119783.0,Telegraph,Airports and nuclear power stations on terror alert as government officials warn of 'credible' cyber threat
1490992408.0,Telegraph,"Outrage as Spain and EU accused of using Brexit to take back Gibraltar, as MPs say Britain will 'not be bullied'"
1490957161.0,Telegraph,UK takes back the right to deport as Britain repeals powers from EU: '...the first EU law to be scrapped after Brexit will be a charter that helps criminals avoid deportation.'
1490956673.0,Telegraph,'An utter disaster': Flood deaths feared as Australian towns swamped after torrential rains
1490925169.0,Telegraph,"Tyrannosaurus rex was a sensitive lover, scientists find"
1490880771.0,Telegraph,North Korea 'to overshadow' US President-Xi Jinping summit with new nuclear test
1490859269.0,Telegraph,Revenge porn crackdown: Offenders who send pictures to family members face two years in jail under new guidelines
1490823009.0,Telegraph,Two British teenagers found guilty of stealing objects from Auschwitz during school trip
1490816912.0,Telegraph,"T heresa May officially triggered Article 50 at 12.30pm today, launching two years of negotiations that will end with Brexit in 2019."
1490749476.0,Telegraph,"Tetris can prevent post-traumatic stress disorder, Oxford University finds"
1490754111.0,Telegraph,World's biggest dinosaur footprints found in 'Australia's Jurassic Park'
1490716493.0,Telegraph,Westminster terrorist's 'shocked' wife 'totally condemns his actions'
1490667242.0,Telegraph,German police warned Anis Amri was planning a suicide attack nine months before Berlin Christmas market massacre
1490662963.0,Telegraph,Mother of Westminster terrorist says she is 'shocked' by his actions and does not condone the attack
1490500837.0,Telegraph,Giant yellow bollards installed outside Buckingham Palace in wake of terror attack
1490398972.0,Telegraph,Eurozone booms as economy shows signs of overcoming its long crisis
1490378482.0,Telegraph,US-led coalition air strikes 'kill more than 200 people' in Mosul
1490386779.0,Telegraph,Blood test detects cancer and pinpoints location...before symptoms appear
1490374363.0,Telegraph,"Brexit a 'failure' for divided European Union, admits Jean-Claude Juncker ahead of 60th anniversary"
1490285125.0,Telegraph,Fillon accuses French government of 'orchestrated leaks' to torpedo his presidential bid
1490228023.0,Telegraph,"The world's first zero-emissions hydrogen train is coming. ""A zero-emissions train that runs on just steam and condensed water has successfully completed its first test run in Germany."""
1490238938.0,Telegraph,Three school children on a trip from France are feared killed in the London terror attack on Westminster Bridge
1490225961.0,Telegraph,Westminster on lockdown after 'shots fired' outside Parliament
1490211430.0,Telegraph,More than 30 dead after US-led coalition air strike hits school sheltering families near Raqqa
1490217297.0,Telegraph,"Thames Water given record £20.3m fine after 1.4bn litres of raw sewage pollute river, killing thousands of fish"
1490179482.0,Telegraph,"Stop bias against Brexit or face fine, BBC warned"
1490155932.0,Telegraph,North Korea releases propaganda video showing US aircraft carrier being blown up
1490118078.0,Telegraph,David Cameron jokes he doesn't have to hear Donald Trump 'wiretaps' anymore
1490133449.0,Telegraph,Blundering officials in India crush Bengal tiger to death with digger while trying to rescue it
1490095764.0,Telegraph,Funnel Web Spider venom may prevent brain damage from strokes
1490076373.0,Telegraph,"BBC risks undermining Brexit and damaging UK with 'pessimistic and skewed' coverage, 70 MPs warn | MPs from across the political spectrum have written to the director-general of the BBC, accusing the corporation of portraying the UK as a ""xenophobic"" nation that regrets the vote to leave the EU"
1490054961.0,Telegraph,Japan offers funeral discounts to elderly drivers who give up their licences
1490070058.0,Telegraph,CCTV shows moment Paris airport attacker grabs soldier
1490057534.0,Telegraph,Beijing park uses face recognition software to wipe out toilet paper theft
1490048139.0,Telegraph,From USA World Cup hero to Lions legend: Amazing sporting tale of Brown family
1489987663.0,Telegraph,Rape victims to be spared court cross-examination as Government brings forward plans for pre-recorded video evidence
1489986126.0,Telegraph,European rocket scientists pledge to make first private Moon landing in 2018
1489956494.0,Telegraph,Police in Italy are investigating a ring of black magic practitioners who allegedly raped young women on the pretext of “cleansing” them of evil spirits.
1489957154.0,Telegraph,A nation divided: tensions mount in Cameroon as English speakers marginalised by Francophone majority
1489915589.0,Telegraph,"Rex Tillerson, the US secretary of state has said he is uncertain of how America and China will continue to co-exist ""for the next half century""."
1489886890.0,Telegraph,British troops arrive in Estonia as German spy chief warns of Russian troop build up
1489880282.0,Telegraph,Donald Trump says Germany owes 'vast sums of money' to Nato and the US
1489866837.0,Telegraph,South American tribe found to have the healthiest hearts ever studied
1489806499.0,Telegraph,Qataris own more of London than the Queen
1489777421.0,Telegraph,"US makes formal apology to Britain over GCHQ spy claims. Intelligence sources say both Mr Spicer and General McMaster, the US National Security Adviser, have apologised over the claims."
1489740025.0,Telegraph,GCHQ issues rare public statement to dismiss Trump Tower wiretapping claims as 'utterly ridiculous'
1489731188.0,Telegraph,Theresa May tells Nicola Sturgeon 'now is not the time' for second independence referendum
1489687459.0,Telegraph,Oxford University to launch medical marijuana research programme
1489696010.0,Telegraph,Newcastle University gets green light to create three parent babies
1489692121.0,Telegraph,"Queen to give royal assent to Article 50 Bill, clearing way for Theresa May to start European Union exit talks"
1489680418.0,Telegraph,"Employers can ban the burka, European court rules"
1489607445.0,Telegraph,Plane passenger suffers burns as headphones catch fire on flight from Beijing to Melbourne
1489617528.0,Telegraph,Hackers Post Pro-Erdogan Messages in Attack on Twitter Accounts
1489546853.0,Telegraph,Saudi Arabia launches its first Girls Council - with only men on stage
1489529483.0,Telegraph,"'Sexist' Polish MEP suspended and fined for saying women should be paid less 'because they are smaller, weaker and less intelligent'"
1489529789.0,Telegraph,The German hometown of Karl Marx has voted to accept a controversial statue of the revolutionary philosopher from China – to the consternation of some of its citizens
1489526048.0,Telegraph,"Employers can ban the burka, European court rules"
1489525346.0,Telegraph,Donald Trump to meet with Chinese leader Xi Jinping - reports
1489479938.0,Telegraph,Turkey targets Dutch with diplomatic sanctions as 'Nazi' row escalates
1489460929.0,Telegraph,German Chancellor Angela Merkel has postponed her trip to Washington to visit with US President Donald Trump due to a late-winter storm expected in the Northeast US
1489309506.0,Telegraph,Imams to be told to preach in English at mosques
1489267307.0,Telegraph,German shopping mall shut on police fears of an attack
1489269786.0,Telegraph,Erdogan calls Dutch 'fascists' as row between Turkey and Netherlands escalates
1489231788.0,Telegraph,"Muhammad Ali Jr questioned at Washington DC airport, day after testifying about similar incident"
1489182039.0,Telegraph,Two dead as ousting of South Korea's disgraced president Park Geun-hye sparks clashes
1489130992.0,Telegraph,"Cannabis boosts risk of stroke and heart attack, independent of tobacco, new study finds"
1489103180.0,Telegraph,Two people have been killed and two others injured after a road bridge in Italy collapsed onto a motorway that ran beneath it
1489098570.0,Telegraph,US rejects China’s plan for North Korea weapons halt
1489057966.0,Telegraph,Expat couple arrested in Abu Dhabi for sex outside of marriage
1489055500.0,Telegraph,Malta's famous Azure Window arch collapses into the sea
1489020056.0,Telegraph,The future of travel? First photos of Hyperloop test track built in Nevada desert
1489016823.0,Telegraph,Revealed: British backpacker treated in hospital days before her road trip with alleged kidnapper
1488955159.0,Telegraph,"Syria's children are suffering from 'toxic stress' after six years of war, report finds"
1488941480.0,Telegraph,Brexit Article 50 bill: Theresa May suffers defeat on 'meaningful vote' amendment as peers back the change by 366 to 268
1488906483.0,Telegraph,US starts deploying anti-missile system THAAD in South Korea after defiant North's latest test
1488870817.0,Telegraph,"Angela Merkel calls for calm after Erdogan's 'Nazi practices' accusation: “Nazi comparisons are always absurd and out of place, because they only lead to trivialising of the Nazis’ crimes against humanity,”"
1488798092.0,Telegraph,Fighting talk from François Fillon at rally as party prepares to oust him as candidate
1488767049.0,Telegraph,"Pakistan warns Trump's generals: sort out 'total mess' in Afghanistan, or Russia will intervene"
1488757359.0,Telegraph,Philippine troops recover body of beheaded German hostage
1488687996.0,Telegraph,'Britain will not have to pay a penny to leave the European Union' - peers hand Theresa May major boost ahead of Brexit talks
1488671913.0,Telegraph,The 'baguette postbox': the trend taking France by storm
1488610874.0,Telegraph,"South Africa President, Jacob Zuma, calls for confiscation of white land without compensation"
1488588806.0,Telegraph,Woman 'accidentally cremated while still alive'
1488555740.0,Telegraph,David Haye tells Tony Bellew to 'enjoy his last couple of days' in final pre-fight press conference
1488504325.0,Telegraph,EU escalates 'visa war' with US with Americans set to lose visa-free travel to Europe
1488512649.0,Telegraph,Artificial human life could soon be grown in lab after embryo breakthrough
1488471214.0,Telegraph,"Gustav Klimt painting sells for a record £47,971,250 at Sotheby's"
1488439224.0,Telegraph,Oldest fossil ever found on Earth dating back 4.2bn years shows alien life on Mars is likely
1488442453.0,Telegraph,Isil 'regrouping in southern Libya with support of al-Qaeda and preparing for further attacks'
1488425024.0,Telegraph,'British Fritzl' Michael Dunn who hid girl in hole behind fridge jailed for 27 years
1488425429.0,Telegraph,"1,500 people, two Mercedes Benz, 459 tonnes of luggage and a golden escalator: How the Saudi King travels"
1488423167.0,Telegraph,Bristol University criticised after 'disadvantaged pupils' scheme offers third of places to private school students
1488396518.0,Telegraph,UK: New drivers who are caught using a phone at the wheel will lose their licence under new legislation that comes into force today.
1488402096.0,Telegraph,Previously untouched 600BC Assyrian palace discovered under shrine demolished by ISIL in Mosul
1488387146.0,Telegraph,Donald Trump postpones state visit to Britain until October amid fears he will create 'a scene'
1488339456.0,Telegraph,Terminal cancer patients in complete remission after one gene therapy treatment
1488315234.0,Telegraph,Indonesian maid 'had kidney stolen in Qatar' in suspected case of organ trafficking
1488265530.0,Telegraph,North Korea 'executed five security officials with anti-aircraft guns' over false reports
1488264300.0,Telegraph,"British defence scientists from the MoD's Forensic Explosive's Laboratory will test for traces of explosives on the wreckage of a Polish presidential plane which crashed in Russia, killing all on board, amid accusations from Poland that the incident was an ""act of Russian aggression”"
1488255725.0,Telegraph,Superbugs which pose greatest threat to humanity identified by World Health Organisation
1488217717.0,Telegraph,"Horror of Mosul where sinkhole became mass grave for 4,000 of Isil's victims"
1488234516.0,Telegraph,"Abdul Sattar Edhi, the humble 'Angel of Mercy' who founded a charity empire from a Pakistani slum"
1488178552.0,Telegraph,Theresa May poised to announce end of free movement for new EU migrants next month
1488001061.0,Telegraph,Environment ministry bans meat at official German government functions
1487991063.0,Telegraph,Turkish expats told to spy on Erdogan critics in German schools
1487970807.0,Telegraph,"Donald Trump says he wants to expand US nuclear arsenal, make it 'top of the pack'"
1487923544.0,Telegraph,Playful tiger knocks drone of the sky in China
1487741591.0,Telegraph,British man who launched Isil suicide attack was Guantanamo Bay detainee awarded £1m compensation
1487706054.0,Telegraph,Barcelona police 'shoot at' driver of speeding truck full of gas cylinders 'driving at high speed towards city centre
1487691144.0,Telegraph,Europe wants Britain to pay billions into EU schemes up until 2023
1487626677.0,Telegraph,"US wants to deepen its relationship with the EU, vice president Mike Pence says on Brussels visit"
1487543110.0,Telegraph,"Russia plotted to overthrow Montenegro's government by assassinating Prime Minister Milo Djukanovic last year, according to senior Whitehall sources"
1487490866.0,Telegraph,Paris clashes: 13 arrested as scuffles break out after protest against police brutality
1487481361.0,Telegraph,Russia's deadly plot to overthrow Montenegro's government by assassinating Prime Minister Milo Djukanovic
1487436057.0,Telegraph,"Streets should not be named after local heroes in case they are later found to be paedophiles, councils told"
1487433613.0,Telegraph,North Korean man arrested in Malaysia over killing of Kim Jong-nam as second autopsy to be conducted
1487412104.0,Telegraph,"Biological terrorism could kill more people than nuclear attacks, Bill Gates to warn world leaders"
1487402566.0,Telegraph,Glasgow bin lorry crash driver admits driving without licence months later
1487347940.0,Telegraph,Lady Mountbatten's grandson: 'She and Prime Minister Nehru had a platonic love affair. They couldn't have had sex - he was impotent'
1487295256.0,Telegraph,Stone sculptures smashed by Isil in ancient city of Palmyra restored to former glory by Italian experts
1487300399.0,Telegraph,Scientists discover 'Zealandia' - a hidden continent off the coast of Australia
1487267819.0,Telegraph,"Probe into French presidential hopeful Francois Fillon's wife's 'fake work' to continue, says prosecutor"
1487265530.0,Telegraph,New Zealand firefighters halt advance of wildfire on city homes in Christchurch
1487205645.0,Telegraph,Self-flying taxi to transport passengers in Dubai
1487200320.0,Telegraph,German newspaper apologises for publishing false allegations of Cologne-style New Year sex assaults in Frankfurt
1487171166.0,Telegraph,EDF shrinks dividends as weak energy markets drag on earnings
1487116160.0,Telegraph,Theresa May formally rejects petition calling for Donald Trump to be barred from making state visit to UK
1487029071.0,Telegraph,"More than a dozen Cabinet ministers want John Bercow gone as Commons Speaker, critics claim"
1487017438.0,Telegraph,Putin and Russia are using cyber attacks and fake news to try and rig three major European elections this year
1486991262.0,Telegraph,Journalists who obtain leaked official material could be sent to prison under new proposals
1486945816.0,Telegraph,Chinese parents cause gene testing boom as they try to discover young children's talents
1486765207.0,Telegraph,Defiant French farmer Cédric Herrou given suspended fine for helping migrants cross border from Italy
1486707783.0,Telegraph,Merkel forced to deny Germany planning to lead a European nuclear superpower
1486667357.0,Telegraph,French nuclear power plant explosion: 'Several injured' after blast in Flamanville
1486613476.0,Telegraph,'Become a suicide bomber' posters appear across London
1486614735.0,Telegraph,Brexit vote: Theresa May wins Commons approval to trigger Article 50 as Labour's Clive Lewis resigns
1486542897.0,Telegraph,Anonymous take down huge chuck of the Darkweb
1486499343.0,Telegraph,750 people killed in the 78 terror attacks Donald Trump claims went 'under reported' - full details
1486446324.0,Telegraph,Female jockeys in France to receive 2kg allowance
1486406365.0,Telegraph,Senior judge slams lawyers for obstructing Rochdale child sex grooming gang deportation case
1486296897.0,Telegraph,Hundreds' of migrants back in Calais weeks after 'Jungle' camp torn down
1486234065.0,Telegraph,Angela Merkel urges Turkey to ensure freedom of expression ahead of referendum giving President Erdogan greater power
1486137471.0,Telegraph,Iran to remove one eye of acid-attack woman in retribution punishment
1486111567.0,Telegraph,Aleppo 'Twitter girl' Bana al-Abed asks Donald Trump: Have you ever gone hungry?
1486104915.0,Telegraph,World's top female chess player resigns after 5 moves having repeatedly been made to play women
1486016288.0,Telegraph,Bangladeshi girl thought to be first female ever with 'tree man syndrome'
1486007473.0,Telegraph,Brexit vote: MPs pass Bill to trigger Article 50 by 498 votes to 114
1485895167.0,Telegraph,Prince Charles warns horrific lessons of WW2 are in danger of being forgotten
