Created,Domain,Title
1495587428.0,ABCNews,Man acknowledges trying to sell satellite secrets to Russia
1495587415.0,ABCNews,Corruption trial begins for ex-South Korean President Park
1495584616.0,ABCNews,2 UN peacekeepers killed in ambush in northern Mali
1495587396.0,ABCNews,US military conducts ground raid in Yemen on AQAP compound
1495588744.0,ABCNews,Likely presidential candidate in Egypt ordered detained
1495588782.0,ABCNews,"Tedros Adhanom Ghebreyesus, Ethiopia's former health minister, has been elected to lead the World Health Organization."
1495588699.0,ABCNews,Special aide to Brazil's Temer arrested in corruption probe
1495563781.0,ABCNews,"Activists: Bahrain police raid Shiite cleric's town, 1 dead"
1495543725.0,ABCNews,Human rights watchdog condemns Thailand hospital bomb
1495528059.0,ABCNews,"Protesters set fire to late President Hugo Chavez's childhood home in western Venezuela on Monday, an opposition lawmaker said, as protests against the South American nation's socialist government grew increasingly hostile"
1495525772.0,ABCNews,China says no mining in its immediate plans for Antarctica
1495503147.0,ABCNews,"1 dead, several injured in protest clashes in Tunisia"
1495493908.0,ABCNews,Michael Flynn will invoke the Fifth Amendment and refuse to honor a Senate committee's subpoena request for documents relating to Russian interference in the election
1495488973.0,ABCNews,Chinese online retailer developing one-ton delivery drones
1495478335.0,ABCNews,Swiss vote to withdraw country from use of nuclear power
1495490067.0,ABCNews,Clashes in Syrian city of Daraa despite it being 'safe zone'
1495489351.0,ABCNews,China confirms detention of 6 Japanese amid report of spying
1495487660.0,ABCNews,Spain PM accuses Catalan leader of blackmail
1495467115.0,ABCNews,"Trump to meet with Israeli and Palestinian leaders, separately"
1495465169.0,ABCNews,Asia-Pacific ministers meet seeking to finalize trade pact
1495418700.0,ABCNews,Melania and Ivanka Trump promote women's empowerment in Saudi Arabia
1495416662.0,ABCNews,"Gunbattle kills 4 rebels, 3 Indian soldiers in Kashmir"
1495418271.0,ABCNews,"Hungary: Protesters rally in defense of university, NGOs"
1495406899.0,ABCNews,Swiss vote to withdraw country from use of nuclear power
1495406259.0,ABCNews,Erdogan to return to Turkey's ruling party as its chairman
1495406524.0,ABCNews,Bulgaria seizes big haul of heroin bound for the Netherlands
1495399859.0,ABCNews,Afghan official: 20 forces killed in coordinated attacks
1495319379.0,ABCNews,Severe weather creates havoc across Germany
1495316909.0,ABCNews,2 suspects face trial soon in deaths of UN experts in Congo
1495319413.0,ABCNews,Afghan officials: 3 killed after gunmen storm bank
1495319272.0,ABCNews,5 dead as Indonesian ferry catches fire in Java Sea
1495299791.0,ABCNews,"Donald Trump arrives in Saudi Arabia, kicking off first foreign trip as president"
1495287313.0,ABCNews,"At WEF, entrepreneurs seen as solution for Mideast troubles"
1495263228.0,ABCNews,Bangladesh arrests 27 men on suspicion of being gay
1495247386.0,ABCNews,Chinese authorities in southwestern Sichuan province have evicted followers and razed hundreds of homes at one of the world's largest centers of Tibetan Buddhist learning in a months-long operation that has drawn protests from Tibetans in exile.
1495247917.0,ABCNews,Brazil's top prosecutor: Prez Temer obstructed justice
1495227326.0,ABCNews,Man dies after setting self ablaze in central Munich square
1495216742.0,ABCNews,"UK police: Assange still wanted for jumping bail, will face arrest if he leaves Ecuadorean embassy in London"
1495194590.0,ABCNews,Chinese fighter flew inverted above US Air Force jet over Yellow Sea
1495160522.0,ABCNews,4 Indonesian soldiers killed in South China Sea exercise after a Chinese-made anti-aircraft cannon malfunctioned
1495168561.0,ABCNews,US officials: New sanctions coming for Venezuela officials
1495154423.0,ABCNews,Albanian politicians postpone parliamentary vote to June 25
1495132665.0,ABCNews,"UN court orders Pakistan not to execute Indian man sentenced to death for espionage, terrorism"
1495132820.0,ABCNews,France's Macron holds 1st Cabinet meeting; half are women
1495130674.0,ABCNews,S. Korean president vows to reopen probe into 1980 massacre
1495132619.0,ABCNews,Portugal seizes 10 metric tons of hashish in Mediterranean
1495137783.0,ABCNews,UN court orders Pakistan not to execute Indian national
1495132705.0,ABCNews,Arrested Thai activist getting S. Korean human rights award
1495132909.0,ABCNews,Building collapse in Sri Lanka's capital injures 19
1495087341.0,ABCNews,DOJ assign special counsel to take over Russia probe
1495093530.0,ABCNews,Canada's government plans to apologize to Canadians who have faced injustice because of their sexuality.
1495097500.0,ABCNews,Brazil's lower house of Congress has approved a measure significantly reducing the size of a fully protected national park in the Amazon rain forest and opening up a big chunk of land for agriculture and other activities
1495101762.0,ABCNews,Australian tax official charged in $123 million fraud probe
1495073671.0,ABCNews,"Macron's Cabinet: 11 men, 11 women cross political spectrum"
1495072988.0,ABCNews,Argentine capital seeks to improve iconic Villa 31 slum
1495070664.0,ABCNews,Ireland to get new leader as Enda Kenny steps down
1495072916.0,ABCNews,The Latest: French foreign minister sees playing vital role
1495072468.0,ABCNews,NATO top brass recommend joining anti-IS coalition
1495070718.0,ABCNews,Official says Berlin attacker could have been arrested
1495068090.0,ABCNews,"Intel sharing at heart of US, Europe talks on laptop ban"
1495050985.0,ABCNews,"17 injured, 2 missing in blast at Polish gunpowder plant"
1495051171.0,ABCNews,Air Canada plane diverted after passenger tries to open door
1495050938.0,ABCNews,Nigeria: Too soon to close camps for Boko Haram's displaced
1495051270.0,ABCNews,"Gunmen storm media compound in eastern Afghanistan, 7 killed"
1495051764.0,ABCNews,Police hold South African for trying Everest without permit
1495051526.0,ABCNews,Iran's top leader urges high turnout in presidential vote
1495055937.0,ABCNews,"Some 20,000 finance workers from Romania's public sector went on strike Monday to protest a move to cut their salaries, a trade union leader said."
1495051609.0,ABCNews,Iran receives first batch of French-made passenger planes
1495051459.0,ABCNews,"EU loosens aid rules to simplify airport, port investment"
1495051839.0,ABCNews,Bribery scandal met with near-silence in Dominican Republic
1495055897.0,ABCNews,"Edouard Philippe, 46, named as prime minister in French President Emmanuel Macron's first government"
1495055861.0,ABCNews,Albania blocks 26 tons of bad poultry imported from Brazil
1495055881.0,ABCNews,"12 dead, dozens injured in east China bus-truck collision"
1495051685.0,ABCNews,Court overturns murder conviction of Danish nurse
1495055836.0,ABCNews,"Residents of Pyongyang, Seoul comment on test of new missile"
1495004559.0,ABCNews,"Trump's disclosure endangered spy placed inside ISIS by Israel, officials say"
1495004580.0,ABCNews,"Syrian government 'systematically rejected' requests to visit prisons accused of torturing inmates, UN says"
1494978664.0,ABCNews,"More killed, hundreds injured in Venezuela protests"
1494972204.0,ABCNews,European official to AP: Country might stop sharing intel with US if Trump gave classified info to Russian diplomats
1494974958.0,ABCNews,"Iran state news: Reformist candidate drops out of presidential election, throws support to Rouhani"
1494974094.0,ABCNews,Iraq says IS now in control of about a tenth of Mosul's west
1494929236.0,ABCNews,Trail of global cyberattack could lead to North Korea
1494920756.0,ABCNews,White House denies report Trump shared intel with Russia
1494896006.0,ABCNews,US accuses Syria of mass executions and burning the bodies - The Trump administration on Monday accused the Syrian government of carrying out mass killings of thousands of prisoners and burning the bodies in a large crematorium outside the capital.
1494892780.0,ABCNews,New French President Emmanuel Macron arrives at German chancellery for meeting with Chancellor Angela Merkel
1494909445.0,ABCNews,EU urges end to Venezuela violence against protesters
1494903301.0,ABCNews,Puerto Rico's development bank forges deal with creditors
1494902592.0,ABCNews,Populist Le Pen now goes for role as top French opposition
1494895328.0,ABCNews,Venezuelans again shut down capital to protest government
1494902624.0,ABCNews,France's new president in Berlin after naming prime minister
1494900330.0,ABCNews,"US accuses Syria of killing thousands, burning bodies in crematorium"
1494887597.0,ABCNews,Venezuelans again shut down capital to protest government
1494807689.0,ABCNews,Pakistanis protest IS attack against pro-Taliban politician
1494783063.0,ABCNews,North Korea launches missile; launch being assessed
1494772211.0,ABCNews,Nepalese vote in 1st local elections in 20 years
1494771923.0,ABCNews,Election in Germany's most populous state could boost Merkel
1494724628.0,ABCNews,Mutinous soldiers in Ivory Coast take over several cities
1494721938.0,ABCNews,IS downs Iraqi helicopter west of Mosul
1494734883.0,ABCNews,"A British researcher unexpectedly found and activated a ""kill switch"" to an ""unprecedented"" ransomware cyberattack that hit hundreds of thousands of computers around the globe at hospitals, government offices, transportation systems and major companies, including FedEx."
1494721406.0,ABCNews,"Egypt discovers new necropolis in Minya, first in area"
1494727029.0,ABCNews,5 believed dead as small plane crashes and burns in Bosnia
1494722623.0,ABCNews,Romanian tourist who died during London attack is buried
1494729196.0,ABCNews,"Ellis Island medals go to Buzz Aldrin, Malala Yousafzai"
1494716811.0,ABCNews,Poland unveils memorial to WWII hero slain by communists
1494689507.0,ABCNews,Nighttime vandals smash some 70 headstones at Rome cemetery
1494689400.0,ABCNews,Afghan official: 3 civilians killed in bomb blast in Kabul
1494641440.0,ABCNews,Kurdish-led forces say they will advance on IS capital
1494647365.0,ABCNews,Candidates trade blows as Iran's presidential election nears
1494644880.0,ABCNews,Brazil's new oil frontier threatens Amazon reef
1494647755.0,ABCNews,"Brazil's Temer celebrates first year, expressing optimism"
1494618089.0,ABCNews,Arson eyed in Rome camper fire that killed 3 Gypsy sisters
1494612574.0,ABCNews,India's Modi emphasizes links with Sri Lanka to deepen ties
1494612439.0,ABCNews,Pakistan's deputy Senate leader wounded in roadside bombing
1494612625.0,ABCNews,France's new president proving a keeper of secrets
1494607479.0,ABCNews,"Small explosion near Rome post office damages car, no injury."
1494599839.0,ABCNews,Nepalese get 1st chance in 20 years to vote for local bodies
1494578703.0,ABCNews,US signs international declaration on climate change despite Trump's past statements
1494580104.0,ABCNews,"Dozens hurt, 1 dead in violent day of protests in Venezuela"
1494567801.0,ABCNews,Attorney: At least 65 Venezuelan military members detained
1494568501.0,ABCNews,Latest fighting kills 37 people in Central African Republic
1494557616.0,ABCNews,India PM arrives in Sri Lanka for UN Buddhist celebration
1494545552.0,ABCNews,Brazilian boy's survival of brain injury is Fatima 'miracle'
1494538978.0,ABCNews,French intellectual gets pie in the face in Serbia
1494535570.0,ABCNews,'Wages won't keep up:' UK central bank says inflation biting
1494535728.0,ABCNews,China's 'Silk Road' stirs unease over its strategic goals
1494538911.0,ABCNews,Macron's mission to revitalize French economy won't be easy
1494535268.0,ABCNews,UK's Labour Party stung by early leak of election platform
1494502383.0,ABCNews,"Dozens hurt, 1 dead in violent day of protests in Venezuela — A 27-year-old man killed Wednesday during another day of violent clashes in Venezuela's capital. More than 1,300 people have been detained in the unrest, not including 250 civilians who have been presented before military tribunals"
1494462855.0,ABCNews,"US reps, Dalai Lama take aim at China sore spot Tibet"
1494469325.0,ABCNews,"Syrian Kurds take largest dam, town from IS"
1494457660.0,ABCNews,"S. Korea's new president will engage North, reconsider THAAD"
1494427769.0,ABCNews,North Korea running a popular hostel in downtown Berlin.
1494418664.0,ABCNews,Hundreds evacuated in Venezuela as tear gas seeps into homes
1494410848.0,ABCNews,"[Most] Rex Tillerson, Sergei Lavrov to meet to discuss Syria, Ukraine"
1494372810.0,ABCNews,Officials fear Russia could try to target US through popular software firm under FBI scrutiny
1494373823.0,ABCNews,Scientists in South Africa reveal more on human-like species
1494374087.0,ABCNews,US Navy ship collides with South Korean fishing boat
1494383695.0,ABCNews,Big child webcam sex bust reveals rising abuse
1494379591.0,ABCNews,Nobel Prize winner to step down as chair of peace group
1494358737.0,ABCNews,Jakarta governor sentenced to 2 years prison for blasphemy
1494358313.0,ABCNews,The Latest: South Korea exit polls see win for liberal Moon
1494357485.0,ABCNews,Facebook removes accounts in fight against fake news
1494358687.0,ABCNews,"The Latest: Paris police move 1,600 from refugee tent camps"
1494370703.0,ABCNews,Liberal Moon Jae-in claims victory in South Korean presidential election after rivals concede
1494358543.0,ABCNews,UN: Up to 245 missing after 2 Mediterranean shipwrecks
1494366124.0,ABCNews,Turkey seeks 40 separate life terms for nightclub attacker
1494354849.0,ABCNews,Car bomb in Thailand's Muslim-dominated south wounds over 50
1494312194.0,ABCNews,Police operation underway at Paris' Gare du Nord station
1494293605.0,ABCNews,"Car bomb hits Mogadishu cafe, killing 5, say Somalia police"
1494299389.0,ABCNews,North Korea claims plot reveals US state-sponsored terrorism
1494293282.0,ABCNews,Hungary's president urges civility in political discourse
1494276112.0,ABCNews,"Iran's Defence Minister has warned Saudi Arabia after their Prince remarked that Saudi Arabia would invade Iran. The Iranian General said he would advise against ""such stupidity""."
1494277870.0,ABCNews,Hungary's president urges civility in political discourse
1494277624.0,ABCNews,"Japan, India to strengthen defense cooperation"
1494261284.0,ABCNews,"Syrian rebels, families start leaving Damascus neighborhood"
1494205402.0,ABCNews,The Latest: German polls: Merkel party leads in local vote
1494207789.0,ABCNews,Nepal wants to limit age for Everest after 85-year-old dies
1494219926.0,ABCNews,Leader of ISIS in Afghanistan killed
1494208770.0,ABCNews,"Czech Girl Scout threatened, police get involved"
1494207242.0,ABCNews,"Floods drive nearly 1,900 from homes in Canada's Quebec"
1494206355.0,ABCNews,Nepal wants to limit age for Everest after 85-year-old dies
1494205748.0,ABCNews,The Latest: 5 Boko Haram leaders swapped for 82 Chibok girls
1494205537.0,ABCNews,Vote in northern Germany a test for Merkel's challenger
1494208006.0,ABCNews,Egypt expects second tranche of IMF loan in June
1494190955.0,ABCNews,"Tense France chooses new president, deciding Europe's fate"
1494193030.0,ABCNews,N. Korea detains another American over alleged hostile acts
1494192733.0,ABCNews,Experts meet in Egypt over moving King Tut property
1494192526.0,ABCNews,Somalia says regional al-Shabab leader is killed in raid
1494192895.0,ABCNews,82 freed Chibok schoolgirls arrive in Nigeria's capital
1494190591.0,ABCNews,"50,000 evacuated in German city after 5 WWII bombs uncovered"
1494193106.0,ABCNews,IS militants kill Christian man in northern Sinai
1494154797.0,ABCNews,"Nepal man, 85, dies trying to become oldest Everest climber"
1494047534.0,ABCNews,Turkey sacks 107 judges and prosecutors linked to Gulen
1494026836.0,ABCNews,"Three former South African heads of state teamed to criticize President Jacob Zuma, who faces growing calls to step down after a series of corruption scandals."
1494026771.0,ABCNews,UN office decries reports that Chinese police seized lawyer
1494023339.0,ABCNews,Belgian prime minister says European Union should end Turkey's membership bid
1494020447.0,ABCNews,Abbas warns of painful steps against Palestinian rival Hamas
1494026745.0,ABCNews,Rio de Janeiro on edge as police wage big anti-crime sweep
1494014157.0,ABCNews,Germany arrests Syrian suspected of IS membership
1494023267.0,ABCNews,Indonesian authorities are searching for scores of inmates who escaped Friday from an overcrowded prison on Sumatra island.
1493979130.0,ABCNews,Trump praises Australian universal health care system at meeting with prime minister
1493963465.0,ABCNews,UN expert in Saudi denied access to imprisoned bloggers and activists
1493944080.0,ABCNews,Death toll in Venezuela protests up to 36 with police death
1493896543.0,ABCNews,Venezuela street protests again turn deadly as overhaul of constitution begins
1493840171.0,ABCNews,Iranian state media says 40 to 50 people have been trapped in a coal mine following an explosion in the north of the country.
1493798663.0,ABCNews,A desperate plea for help as four African nations near a famine crisis
1493783234.0,ABCNews,"Powerful Saudi prince says no space for dialogue with rival Iran due to its Shiite ambitions ""to control the Islamic world."""
1493762469.0,ABCNews,Turkey's Erdogan says he has 'nothing to discuss' with EU
1493757260.0,ABCNews,Czech Prime Minister Bohuslav Sobotka announces government resignation
1493702272.0,ABCNews,Japan PM says he will initiate debate on new constitution
1493702358.0,ABCNews,"Minibus overturns in Iran, killing 2 German tourists"
1493701973.0,ABCNews,Canada defense minister sorry for exaggerating military role
1493661302.0,ABCNews,"N. Korea missile fears in Japan: 'Whatever will be, will be'"
1493661361.0,ABCNews,Polish official suspended over image of Tusk as SS officer
1493661268.0,ABCNews,Israel stops to honor fallen soldiers and terror victims
1493640497.0,ABCNews,Poland police forcibly remove anti-nationalist protesters
1493656545.0,ABCNews,Pentagon: 45 civilians killed by coalition strikes
1493616563.0,ABCNews,Germany's Merkel presses Saudi Arabia on refugees and rights
1493513523.0,ABCNews,"The Islamic State group claimed responsibility for a bombing that targeted a police station in Baghdad's center Friday night, and Iraqi officials said the blast killed four people and wounded eight."
1493448564.0,ABCNews,"Police, indigenous in Brazil clash with tear gas and spears"
1493440325.0,ABCNews,"Public transport largely came to a halt across much of Brazil as demonstrators blocked roads and clashed with police in a general strike to protest proposed changes to labor laws and the pension system. Millions stayed home , and thousands flooded the streets in anger"
1493413399.0,ABCNews,Lawmakers attacked as protesters storm Macedonian parliament
1493361472.0,ABCNews,The gang that blasted into an armored company's vault this week got away with $11.72 million in cash — the biggest heist in Paraguay's history. About 50 attackers armed with assault rifles used explosives to open the vault of the Prosegur company
1493342660.0,ABCNews,Israel military says its Patriot Missile Defense system intercepted an incoming projectile from Syria over Golan Heights
1493354491.0,ABCNews,"President Donald Trump has decided that the U.S. will renegotiate the North American Free Trade Agreement but is still considering scrapping the pact if a ""fair deal"" is not reached with Mexico and Canada."
1493351800.0,ABCNews,EU official condemns violence in Macedonia
1493351931.0,ABCNews,US envoy Nikki Haley accuses Russia of allowing Syria to deny needed aid
1493351757.0,ABCNews,"Turkey's electoral authority releases final referendum tally, confirms narrow win for Erdogan's 'yes' camp"
1493354424.0,ABCNews,Royals from Gulf Arab countries met on Thursday in Saudi Arabia to discuss regional security and try and formulate a unified voice on rival Iran.
1493354325.0,ABCNews,Police in Scotland warn lawmakers over suspicious packages
1493280245.0,ABCNews,Trump gives Pentagon authority to set troop levels in Syria and Iraq
1493290451.0,ABCNews,"Russia criticized Turkey's airstrikes against Kurdish forces in Syria and Iraq, saying they hindered efforts to combat the Islamic State group, as Turkish troops and Syrian Kurdish fighters traded fire across the increasingly tense frontier."
1493290297.0,ABCNews,Venezuela says it will initiate its withdrawal from the Organization of American States
1493235157.0,ABCNews,US military begins installations of missile defenses in South Korea
1493232809.0,ABCNews,"More than 700,000 granted asylum in EU in 2016"
1493242392.0,ABCNews,US Navy fires warning flare at Iran vessel in Persian Gulf
1493231143.0,ABCNews,China launches 1st domestically-made aircraft carrier
1493241053.0,ABCNews,Merkel spokesman backs German FM in spat over Israel visit
1493196812.0,ABCNews,Canadian leader responds to lumber tariffs imposed by the US
1493175407.0,ABCNews,Canadian PM responds to lumber tariffs imposed by the US
1493160876.0,ABCNews,Police in Spain arrested 9 suspected members of a jihadi group in raids that might help resolve recent deadly attacks in Belgium and France.
1493129918.0,ABCNews,Russia is believed to be the source of an influx of weapons to the Taliban in Afghanistan
1493088134.0,ABCNews,Far-right presidential hopeful Marine Le Pen says she is temporarily stepping down as party's leader
1493022270.0,ABCNews,"Antarctica is melting faster than originally thought, new study finds"
1493024864.0,ABCNews,"Ryan: Russia probe will help US allies | ""One thing we know for certain is that Russia meddled in our election,"" Ryan said. ""This is a foreign country trying to meddle within the internal activities of a sovereign country or a democracy."""
1492993758.0,ABCNews,"United States remains vulnerable to North Korean cyber-attack, analysts say"
1492976528.0,ABCNews,Human rights advocate found stabbed to death in the Maldives
1492933325.0,ABCNews,"Mexico sees 2,020 killings in March, worst month since 2011"
1492898761.0,ABCNews,Lithuanian Intelligence Service Helps Soldiers in Eastern Ukraine
1492841813.0,ABCNews,Russia denies it is moving troops close to North Korea
1492832376.0,ABCNews,Trump predicts Paris attack will have ‘big effect’ on French election
1492830492.0,ABCNews,Son of Russian Parliament member sentenced in hacking case
1492801048.0,ABCNews,"After sex video, S. Korea accused of targeting gay soldiers"
1492801039.0,ABCNews,"Germ in raw milk, poultry now tops food poisoning list"
1492801017.0,ABCNews,2 dead after rail cars carrying logs hit work crew in Canada
1492801284.0,ABCNews,"South Africa painting has Mandela, Zuma in apparent sex act"
1492798010.0,ABCNews,Trump calls Canada's dairy trade policies a 'disgrace'
1492667886.0,ABCNews,Israeli defense officials: Assad still has chemical weapons
1492665260.0,ABCNews,53 arrested in Nigeria for celebrating gay wedding: Police
1492665351.0,ABCNews,Canada police charge woman with smuggling refugees from US
1492665506.0,ABCNews,Senior Israeli defense officials say Syria's Assad is still believed to possess up to 3 tons of chemical weapons
1492659326.0,ABCNews,"After diplomatic talks today in Beijing, top diplomats from China and the EU pledged closer cooperation: EU foreign policy chief Mogherini and State Councilor Yang, China’s highest-ranking diplomat, announced to intensify cooperation ""for the benefit not only of our citizens, but also of the world"""
1492626711.0,ABCNews,Syria resumes reciprocal evacuations after deadly bombing
1492600549.0,ABCNews,Trump administration says Iran complying with nuclear deal
1492544042.0,ABCNews,UN rights chief alarmed over Burundi militia 'rape' song
1492543930.0,ABCNews,At least 26 dead as bus plunges into ravine in Philippines
1492496873.0,ABCNews,Brazilian construction conglomerate Odebrecht was ordered to pay $2.6 billion in fines to settle charges it bribed officials in a dozen countries. The payout order was determined after a plea agreement was reached in December that Odebrecht could not afford to pay more than that amount
1492471761.0,ABCNews,"Canada is moving to strip citizenship from a man accused of slaughtering villagers in Guatemala using a grenade, gun and sledgehammer during the country's civil war."
1492473819.0,ABCNews,Trump warns North Korea to 'behave'
1492471788.0,ABCNews,UN: Nearly half a million Iraqis have fled Mosul fighting
1492471722.0,ABCNews,Small plane crashes next to Lisbon-area supermarket; 5 dead
1492471583.0,ABCNews,Congo returns militia leader's body; new chief named
1492450292.0,ABCNews,South Korean prosecutors indicted ex-President Park Geun-hye on high-profile corruption charges that could potentially send her to jail for life.
1492456231.0,ABCNews,"Ex-South Korean leader Park indicted, faces trial"
1492400995.0,ABCNews,Hundreds march against far-right French presidential hopeful
1492400974.0,ABCNews,South Sudan army denies charges its troops killed 14 in Raga
1492380258.0,ABCNews,Trump ‘will take action’ to end any North Korea threat to US: top security adviser
1492378674.0,ABCNews,The Latest: Japan protests N. Korean missile test attempt
1492379574.0,ABCNews,High Alert | North Korea - Week Transcript
1492356928.0,ABCNews,Pence lands in South Korea after North's failed launch
1492290480.0,ABCNews,Iraq: IS launches chlorine gas attacks in western Mosul
1492265666.0,ABCNews,World Food Program 'horrified' as South Sudan workers killed
1492265753.0,ABCNews,Mexican journalist killed on Baja California peninsula
1492265688.0,ABCNews,Syrians face catch-22 in mass evacuation: Their destination may be worse
1492260361.0,ABCNews,"North Korea rolls out missiles, other weaponry at parade"
1492246516.0,ABCNews,New leak suggests NSA penetrated Mideast banking networks
